{
  "schemaVersion": "project-os.workspace-facts.v0.1",
  "generatedAt": "2026-07-08T00:00:00+08:00",
  "mode": "existing-project",
  "status": "connected",
  "governanceLevel": {
    "current": "L1",
    "name": "治理索引",
    "description": "项目已零侵入接入，工程文件会被自动扫描、归类和只读预览。",
    "next": "L2",
    "nextName": "建议修复",
    "levels": [
      {
        "id": "L0",
        "name": "只读体检",
        "description": "扫描、识别、健康检查，不改工程文件。"
      },
      {
        "id": "L1",
        "name": "治理索引",
        "description": "建立项目档案、治理域、工程文件索引和上下文记忆。"
      },
      {
        "id": "L2",
        "name": "建议修复",
        "description": "生成问题解释、修复建议和变更提案草稿。"
      },
      {
        "id": "L3",
        "name": "受控修复",
        "description": "用户确认后自动改文件、运行检查并沉淀记录。"
      },
      {
        "id": "L4",
        "name": "持续治理",
        "description": "接入 CI 或定期任务，持续扫描、提醒和复审豁免。"
      }
    ]
  },
  "project": {
    "name": "OmniDesk",
    "path": "/Users/heqiao/Desktop/Claude练习/OmniDesk",
    "kind": "local-ai-workbench",
    "detectedStack": [
      "Tauri",
      "React",
      "Vite",
      "Rust",
      "Project OS"
    ],
    "lifecycle": "stabilizing",
    "description": "OmniDesk / Project OS Desktop 是本地 AI 工程工作台，用来让新老项目被理解、治理、开发和持续演进。"
  },
  "summary": {
    "overview": {
      "status": "confirmed",
      "title": "项目概览",
      "body": "OmniDesk 是 Project OS 的桌面工作台入口，聚焦项目理解、目标任务、上下文记忆、本地模型配置和受控执行，不是完整 IDE。",
      "sources": [
        "PROJECT.md",
        ".project-os/state.json",
        ".project-os/project-profile.json"
      ],
      "confidence": 0.95
    },
    "currentProgress": {
      "status": "confirmed",
      "title": "当前进度",
      "body": "当前处于工作区治理自验证期，正在用 OmniDesk 自身验证老项目接入、工作区菜单、设计 token、项目文件导航和治理事实源。",
      "sources": [
        "PROJECT.md",
        "HANDOFF.md",
        ".project-os/state.json"
      ],
      "confidence": 0.88
    },
    "runbook": {
      "status": "confirmed",
      "title": "启动方式",
      "body": "桌面端位于 desktop/，常用命令包括 npm run dev、npm run web:dev、npm run web:build 和 npm run build。",
      "sources": [
        "desktop/package.json",
        "desktop/README.md",
        "docs/RUNBOOK.md"
      ],
      "confidence": 0.9
    },
    "riskBoundary": {
      "status": "inferred",
      "title": "风险边界",
      "body": "主要风险是工作区菜单仍可能展示静态文案、老项目接入流程尚未形成真实 UI、目标任务对话项目档案之间仍需避免重复。",
      "sources": [
        "HANDOFF.md",
        ".project-os/project-profile.json",
        "PROJECT.md"
      ],
      "confidence": 0.78
    },
    "localState": {
      "status": "confirmed",
      "title": "本地状态",
      "body": "项目已有 .project-os 状态、目标、项目档案、模型 catalog、桌面 registry 和本地运行记录；当前工作区可作为正式治理项目继续推进。",
      "sources": [
        ".project-os/state.json",
        ".project-os/goals.json",
        ".project-os/desktop-registry.json",
        ".project-os/runs/"
      ],
      "confidence": 0.86
    }
  },
  "evidence": [
    {
      "source": "PROJECT.md",
      "kind": "project-status",
      "status": "found",
      "note": "记录项目定位、阶段、架构、当前进度和工作区治理口径。"
    },
    {
      "source": "HANDOFF.md",
      "kind": "handoff",
      "status": "found",
      "note": "记录最近完成、风险和下一步建议。"
    },
    {
      "source": "desktop/package.json",
      "kind": "run-config",
      "status": "found",
      "note": "识别到 Tauri/Vite 桌面端启动和构建命令。"
    },
    {
      "source": ".project-os/state.json",
      "kind": "project-state",
      "status": "found",
      "note": "已有机器可读项目状态。"
    },
    {
      "source": ".project-os/project-profile.json",
      "kind": "project-profile",
      "status": "found",
      "note": "已有结构化项目档案。"
    },
    {
      "source": ".project-os/workspace-facts.json",
      "kind": "workspace-facts",
      "status": "found",
      "note": "当前文件是 OmniDesk 自身工作区事实样例。"
    }
  ],
  "governanceDomains": [
    {
      "id": "project-identity",
      "title": "项目概览",
      "description": "项目身份、定位、类型和生命周期。",
      "files": [
        "PROJECT.md",
        "README.md",
        ".project-os/project-profile.json",
        ".project-os/state.json"
      ],
      "updatesWhen": "项目定位、类型、阶段或工作区状态变化时自动刷新。",
      "fileStatuses": [
        {
          "path": "PROJECT.md",
          "status": "changed",
          "previewable": true
        },
        {
          "path": "README.md",
          "status": "found",
          "previewable": true
        },
        {
          "path": ".project-os/project-profile.json",
          "status": "found",
          "previewable": true
        },
        {
          "path": ".project-os/state.json",
          "status": "changed",
          "previewable": true
        }
      ],
      "statusSummary": {
        "found": 2,
        "missing": 0,
        "changed": 2,
        "stale": 0,
        "generated": 0,
        "ignored": 0
      }
    },
    {
      "id": "current-progress",
      "title": "当前进度",
      "description": "最近完成、当前推进和下一步。",
      "files": [
        "HANDOFF.md",
        "PROJECT.md",
        ".project-os/goals.json",
        ".project-os/state.json"
      ],
      "updatesWhen": "目标任务、交接记录或 git 状态变化时自动刷新。",
      "fileStatuses": [
        {
          "path": "HANDOFF.md",
          "status": "changed",
          "previewable": true
        },
        {
          "path": "PROJECT.md",
          "status": "changed",
          "previewable": true
        },
        {
          "path": ".project-os/goals.json",
          "status": "changed",
          "previewable": true
        },
        {
          "path": ".project-os/state.json",
          "status": "changed",
          "previewable": true
        }
      ],
      "statusSummary": {
        "found": 0,
        "missing": 0,
        "changed": 4,
        "stale": 0,
        "generated": 0,
        "ignored": 0
      }
    },
    {
      "id": "runbook",
      "title": "启动方式",
      "description": "启动、构建、验证和常用脚本。",
      "files": [
        "package.json",
        "desktop/package.json",
        "docs/RUNBOOK.md",
        "desktop/README.md"
      ],
      "updatesWhen": "package scripts、运行说明或桌面端配置变化时自动刷新。",
      "fileStatuses": [
        {
          "path": "package.json",
          "status": "missing",
          "previewable": false
        },
        {
          "path": "desktop/package.json",
          "status": "found",
          "previewable": true
        },
        {
          "path": "docs/RUNBOOK.md",
          "status": "found",
          "previewable": true
        },
        {
          "path": "desktop/README.md",
          "status": "found",
          "previewable": true
        }
      ],
      "statusSummary": {
        "found": 3,
        "missing": 1,
        "changed": 0,
        "stale": 0,
        "generated": 0,
        "ignored": 0
      }
    },
    {
      "id": "risk-boundary",
      "title": "风险边界",
      "description": "不可随意改动的约束、风险和协作边界。",
      "files": [
        "HANDOFF.md",
        "PROJECT.md",
        ".project-os/project-profile.json"
      ],
      "updatesWhen": "协作规则、风险说明或项目档案变化时自动刷新。",
      "fileStatuses": [
        {
          "path": "HANDOFF.md",
          "status": "changed",
          "previewable": true
        },
        {
          "path": "PROJECT.md",
          "status": "changed",
          "previewable": true
        },
        {
          "path": ".project-os/project-profile.json",
          "status": "found",
          "previewable": true
        }
      ],
      "statusSummary": {
        "found": 1,
        "missing": 0,
        "changed": 2,
        "stale": 0,
        "generated": 0,
        "ignored": 0
      }
    },
    {
      "id": "local-state",
      "title": "本地状态",
      "description": "Git、本地工作区、运行状态和 Project OS 状态。",
      "files": [
        ".git",
        ".project-os/state.json",
        ".project-os/runs/",
        ".project-os/desktop-registry.json"
      ],
      "updatesWhen": "文件变更、git 状态或 Project OS 运行状态变化时自动刷新。",
      "fileStatuses": [
        {
          "path": ".git",
          "status": "found",
          "previewable": false
        },
        {
          "path": ".project-os/state.json",
          "status": "changed",
          "previewable": true
        },
        {
          "path": ".project-os/runs/",
          "status": "ignored",
          "previewable": false
        },
        {
          "path": ".project-os/desktop-registry.json",
          "status": "found",
          "previewable": true
        }
      ],
      "statusSummary": {
        "found": 2,
        "missing": 0,
        "changed": 1,
        "stale": 0,
        "generated": 0,
        "ignored": 1
      }
    },
    {
      "id": "design-implementation",
      "title": "设计实现",
      "description": "架构、界面规范、数据契约和实现结构。",
      "files": [
        "docs/ARCHITECTURE.md",
        "docs/DESIGN_STANDARDS.md",
        "schemas/workspace-facts.schema.json",
        "desktop/src/main.jsx",
        "desktop/src/styles.css",
        "desktop/src-tauri/src/main.rs"
      ],
      "updatesWhen": "架构、设计 token、schema 或源码入口变化时自动刷新。",
      "fileStatuses": [
        {
          "path": "docs/ARCHITECTURE.md",
          "status": "found",
          "previewable": true
        },
        {
          "path": "docs/DESIGN_STANDARDS.md",
          "status": "found",
          "previewable": true
        },
        {
          "path": "schemas/workspace-facts.schema.json",
          "status": "changed",
          "previewable": true
        },
        {
          "path": "desktop/src/main.jsx",
          "status": "changed",
          "previewable": true
        },
        {
          "path": "desktop/src/styles.css",
          "status": "changed",
          "previewable": true
        },
        {
          "path": "desktop/src-tauri/src/main.rs",
          "status": "changed",
          "previewable": true
        }
      ],
      "statusSummary": {
        "found": 2,
        "missing": 0,
        "changed": 4,
        "stale": 0,
        "generated": 0,
        "ignored": 0
      }
    },
    {
      "id": "engineering-assets",
      "title": "工程资产",